{
  "theme": "light-theme",
  "dailyNotes": {
    "2026-06-30": "Daily reflection note"
  },
  "projects": [
    {
      "id": "proj-api",
      "name": "API Project",
      "status": "active",
      "color": "#22c55e"
    }
  ],
  "skills": [],
  "tasks": [
    {
      "id": "task-api",
      "title": "Persist me",
      "status": "todo",
      "priority": "medium",
      "projectId": "proj-api"
    }
  ],
  "navUsage": {
    "lastView": "tasks",
    "recentViews": [],
    "pins": [
      "tasks"
    ],
    "views": {},
    "projects": {},
    "moreExpanded": false,
    "moreProjectsExpanded": false,
    "totalEvents": 0
  },
  "updated_at": "2026-06-30T17:39:13.029Z"
}
